{
  "schema_version": "1.0.0",
  "url": "https://developer.apple.com/design/human-interface-guidelines/game-controls",
  "canonical_url": "https://developer.apple.com/design/human-interface-guidelines/game-controls",
  "slug": "game-controls",
  "title": "Game controls",
  "category": "inputs",
  "page_kind": "guidance",
  "platforms": [
    "ios",
    "ipados",
    "macos",
    "tvos",
    "visionos"
  ],
  "retrieved_at": "2026-07-21T09:49:49.744Z",
  "source_hash": "138f1871dc5e4894107c77a61dd11048737d7920a88cf250b49fc1ba7b5b5431",
  "summary": {
    "en": "Game controls organizes Apple design guidance across 10 documented section paths.",
    "ja": "Game controlsに関するAppleの設計ガイダンスを、10件のセクション階層で整理した記録です。"
  },
  "section_paths": [
    [
      "Game controls",
      "Touch controls"
    ],
    [
      "Game controls",
      "Physical controllers"
    ],
    [
      "Game controls",
      "Keyboards"
    ],
    [
      "Game controls",
      "Platform considerations"
    ],
    [
      "Game controls",
      "Platform considerations",
      "visionOS"
    ],
    [
      "Game controls",
      "Resources"
    ],
    [
      "Game controls",
      "Resources",
      "Related"
    ],
    [
      "Game controls",
      "Resources",
      "Developer documentation"
    ],
    [
      "Game controls",
      "Resources",
      "Videos"
    ],
    [
      "Game controls",
      "Change log"
    ]
  ],
  "guidance_candidates": [
    {
      "text": "Determine whether it makes sense to display virtual controls on top of game content",
      "section_path": [
        "Game controls",
        "Touch controls"
      ],
      "source_sentence_hash": "8045e1c5f4e0cdac4ee1623423953dee0caa9f4bb8af9cf5c5fc260700c44aea",
      "word_count": 14
    },
    {
      "text": "Place virtual buttons where they’re easy to access",
      "section_path": [
        "Game controls",
        "Touch controls"
      ],
      "source_sentence_hash": "8351eb1f09b8022befef4c730ac35a9f107e68a647a66e66f480810ae8c07b2e",
      "word_count": 8
    },
    {
      "text": "Make sure controls are large enough",
      "section_path": [
        "Game controls",
        "Touch controls"
      ],
      "source_sentence_hash": "16f767e48047c135869bbded3af48351b5e51a7c36f52dc93acf96764ffdfe35",
      "word_count": 6
    },
    {
      "text": "Always include visible and tactile press states",
      "section_path": [
        "Game controls",
        "Touch controls"
      ],
      "source_sentence_hash": "390f249ef78e45b262e145be768751f147081a266ecae5053f33e5a5598fbeba",
      "word_count": 7
    },
    {
      "text": "Use symbols that communicate the actions they perform",
      "section_path": [
        "Game controls",
        "Touch controls"
      ],
      "source_sentence_hash": "0afdbce57d043b5201669ed08c97f89a99ff74644d34b1ed60154cf73ce3acc4",
      "word_count": 8
    },
    {
      "text": "Show and hide virtual controls to reflect gameplay",
      "section_path": [
        "Game controls",
        "Touch controls"
      ],
      "source_sentence_hash": "45d0619bf495f598b592af4c3ef8bb18cf3afaa7845ffaee49454eb60b56dcfe",
      "word_count": 8
    },
    {
      "text": "Combine functionality into a single control",
      "section_path": [
        "Game controls",
        "Touch controls"
      ],
      "source_sentence_hash": "0db28ad5366e01db9e2b468bea50ba0b258d90aa320e2387823858629193bf61",
      "word_count": 6
    },
    {
      "text": "Map movement and camera controls to predictable behavior",
      "section_path": [
        "Game controls",
        "Touch controls"
      ],
      "source_sentence_hash": "ccb7884621f4b19e15659bcdccdbe9e92951fa8649c70393c69f35426d157cfe",
      "word_count": 8
    },
    {
      "text": "Support the platform’s default interaction method",
      "section_path": [
        "Game controls",
        "Physical controllers"
      ],
      "source_sentence_hash": "6e5482baacfa584f3fccd6ad3cd579a966213b00c8b2f5fd6cd8177ec1450c7e",
      "word_count": 6
    },
    {
      "text": "Tell people about game controller requirements",
      "section_path": [
        "Game controls",
        "Physical controllers"
      ],
      "source_sentence_hash": "024c4d867f6fef9f1982dbd5b5d4da47a8e9d2bbf2a5de7a3a47e3473a88e750",
      "word_count": 6
    },
    {
      "text": "Automatically detect whether a controller is paired",
      "section_path": [
        "Game controls",
        "Physical controllers"
      ],
      "source_sentence_hash": "a4e27759fcff39955803687d3cba4c6889da13cc200b1d0bf1c79966aa461bb7",
      "word_count": 7
    },
    {
      "text": "Customize onscreen content to match the connected game controller",
      "section_path": [
        "Game controls",
        "Physical controllers"
      ],
      "source_sentence_hash": "5daab59934572293091c866ada9f7811509e2d906d56b0d38f06704399c8bf65",
      "word_count": 9
    },
    {
      "text": "Map controller buttons to expected UI behavior",
      "section_path": [
        "Game controls",
        "Physical controllers"
      ],
      "source_sentence_hash": "cfb22eac910ba30b5cc998a601c7baba5cb7d84e6ed18983f3ca15ffd9c07a41",
      "word_count": 7
    },
    {
      "text": "Support multiple connected controllers",
      "section_path": [
        "Game controls",
        "Physical controllers"
      ],
      "source_sentence_hash": "17de3036cfd09643f7409103a97bc2694a2029b8b15f077f72654bf0871d9bd6",
      "word_count": 4
    },
    {
      "text": "Prefer using symbols, not text, to refer to game controller elements",
      "section_path": [
        "Game controls",
        "Physical controllers"
      ],
      "source_sentence_hash": "8ade6941e1dd8ca3f37c4a66ea831a18f2522b4aade5547828e254b03f927d13",
      "word_count": 11
    },
    {
      "text": "Prioritize single-key commands",
      "section_path": [
        "Game controls",
        "Keyboards"
      ],
      "source_sentence_hash": "7b9f835d8447d9aaca86f9007c3a2343e75a2ca54a6142eb7cbadd84fe5a06ff",
      "word_count": 3
    },
    {
      "text": "Test key binding comfort game using an Apple keyboard",
      "section_path": [
        "Game controls",
        "Keyboards"
      ],
      "source_sentence_hash": "1025e4c5f06a92750de55f04fe6c4a4cbdddc2b1bd9f96fd16a0920fc16edfa6",
      "word_count": 9
    },
    {
      "text": "Take the proximity of keys into account",
      "section_path": [
        "Game controls",
        "Keyboards"
      ],
      "source_sentence_hash": "08bd1b5a792bed64732f4af212c34f76a2f6919d225bb5f37b61c2e6dcbde3fc",
      "word_count": 7
    },
    {
      "text": "Let players customize key bindings",
      "section_path": [
        "Game controls",
        "Keyboards"
      ],
      "source_sentence_hash": "83214683c89626f25627f61390a278bdb5daa7cb470c30ef80cc4a4edd47d59e",
      "word_count": 5
    },
    {
      "text": "Match spatial game controller behavior to hand input",
      "section_path": [
        "Game controls",
        "Platform considerations",
        "visionOS"
      ],
      "source_sentence_hash": "e93afe82398bfafd6d2acc9e41a3a1e8dbc1f830d051183ee650c3c32b408e52",
      "word_count": 8
    },
    {
      "text": "Developer documentation",
      "section_path": [
        "Game controls",
        "Resources",
        "Developer documentation"
      ],
      "source_sentence_hash": "b985db6433c8e9669caebab194ee62b3b3af7505decd93ea111f546d714e1907",
      "word_count": 2
    }
  ],
  "reference_notes": [
    {
      "section_path": [
        "Game controls",
        "Platform considerations"
      ],
      "note": "Section recorded for human review; no short atomic guidance lead was detected."
    },
    {
      "section_path": [
        "Game controls",
        "Resources"
      ],
      "note": "Section recorded for human review; no short atomic guidance lead was detected."
    },
    {
      "section_path": [
        "Game controls",
        "Resources",
        "Related"
      ],
      "note": "Section recorded for human review; no short atomic guidance lead was detected."
    },
    {
      "section_path": [
        "Game controls",
        "Resources",
        "Videos"
      ],
      "note": "Section recorded for human review; no short atomic guidance lead was detected."
    },
    {
      "section_path": [
        "Game controls",
        "Change log"
      ],
      "note": "Section recorded for human review; no short atomic guidance lead was detected."
    }
  ],
  "related_hig_urls": [
    "https://developer.apple.com/design/human-interface-guidelines/layout",
    "https://developer.apple.com/design/human-interface-guidelines/playing-haptics",
    "https://developer.apple.com/design/human-interface-guidelines/sf-symbols",
    "https://developer.apple.com/design/human-interface-guidelines/gestures",
    "https://developer.apple.com/design/human-interface-guidelines/designing-for-games",
    "https://developer.apple.com/design/human-interface-guidelines/keyboards"
  ]
}
