{
  "schema_version": "1.0.0",
  "url": "https://developer.apple.com/design/human-interface-guidelines/activity-rings",
  "canonical_url": "https://developer.apple.com/design/human-interface-guidelines/activity-rings",
  "slug": "activity-rings",
  "title": "Activity rings",
  "category": "components",
  "page_kind": "guidance",
  "platforms": [
    "ios",
    "ipados",
    "watchos"
  ],
  "retrieved_at": "2026-07-21T07:07:26.079Z",
  "source_hash": "4ac6aa35a25990aaa7e421e8516d02b26bd8c636a7d8f93f5f9e24b2fc9abeb5",
  "summary": {
    "en": "Activity rings organizes Apple design guidance across 8 documented section paths.",
    "ja": "Activity ringsに関するAppleの設計ガイダンスを、8件のセクション階層で整理した記録です。"
  },
  "section_paths": [
    [
      "Activity rings",
      "Best practices"
    ],
    [
      "Activity rings",
      "Platform considerations"
    ],
    [
      "Activity rings",
      "Platform considerations",
      "iOS"
    ],
    [
      "Activity rings",
      "Resources"
    ],
    [
      "Activity rings",
      "Resources",
      "Related"
    ],
    [
      "Activity rings",
      "Resources",
      "Developer documentation"
    ],
    [
      "Activity rings",
      "Resources",
      "Videos"
    ],
    [
      "Activity rings",
      "Change log"
    ]
  ],
  "guidance_candidates": [
    {
      "text": "Display Activity rings when they’re relevant to the purpose of your app",
      "section_path": [
        "Activity rings",
        "Best practices"
      ],
      "source_sentence_hash": "1b8e2584f66ebf44276f740768f01352b449c625a3fa0181c321470915da0626",
      "word_count": 12
    },
    {
      "text": "Use Activity rings only to show Move, Exercise, and Stand information",
      "section_path": [
        "Activity rings",
        "Best practices"
      ],
      "source_sentence_hash": "f8763f17146755ae6242dd1aed97eeaf28cefdeadced9c21ef529c38c61c130a",
      "word_count": 11
    },
    {
      "text": "Use Activity rings to show progress for a single person",
      "section_path": [
        "Activity rings",
        "Best practices"
      ],
      "source_sentence_hash": "4480a8bdcecec06ef5f746ba5b7d4199c4f714f9cbaec39518dce5980d8a38ed",
      "word_count": 10
    },
    {
      "text": "Always keep the visual appearance of Activity rings the same, regardless of where you display them",
      "section_path": [
        "Activity rings",
        "Best practices"
      ],
      "source_sentence_hash": "69c274c654c0e3d6d12db4801d68a1092a7914011c8654fd63e56d04c7211557",
      "word_count": 16
    },
    {
      "text": "To display a label or value that’s directly associated with an Activity ring, use the colors that match it",
      "section_path": [
        "Activity rings",
        "Best practices"
      ],
      "source_sentence_hash": "0305db1ececba50be188b0c600b258c93e4e69ea6c0ed18ce6ad13f9c1042d76",
      "word_count": 19
    },
    {
      "text": "Maintain Activity ring margins",
      "section_path": [
        "Activity rings",
        "Best practices"
      ],
      "source_sentence_hash": "f335242e9313be9bc26c7301c598ec8ff6f194604b8d13bcf6d2de2291168d90",
      "word_count": 4
    },
    {
      "text": "Differentiate other ring-like elements from Activity rings",
      "section_path": [
        "Activity rings",
        "Best practices"
      ],
      "source_sentence_hash": "df60c9d602bd3284a3c9890c45c9d15b12c1b5dd92c8bfab90e69a7c898a7892",
      "word_count": 7
    },
    {
      "text": "Don’t send notifications that repeat the same information the Activity app sends",
      "section_path": [
        "Activity rings",
        "Best practices"
      ],
      "source_sentence_hash": "bb0d834c4d1aea3ed8f99d93c6201de229c0786f92b60a61b3241fdae26da39d",
      "word_count": 12
    },
    {
      "text": "Don’t use Activity rings for decoration",
      "section_path": [
        "Activity rings",
        "Best practices"
      ],
      "source_sentence_hash": "d1685e867723c962f0465fd57d0ad64497edc70fa374d596ae3d9a94eefe69ef",
      "word_count": 6
    },
    {
      "text": "Don’t use Activity rings for branding",
      "section_path": [
        "Activity rings",
        "Best practices"
      ],
      "source_sentence_hash": "58a9db2f5760fca0b4c6ea767fe24ad8d12e2799d6efa53989c56e1601a3e7e8",
      "word_count": 6
    },
    {
      "text": "Developer documentation",
      "section_path": [
        "Activity rings",
        "Resources",
        "Developer documentation"
      ],
      "source_sentence_hash": "b985db6433c8e9669caebab194ee62b3b3af7505decd93ea111f546d714e1907",
      "word_count": 2
    }
  ],
  "reference_notes": [
    {
      "section_path": [
        "Activity rings",
        "Platform considerations"
      ],
      "note": "Section recorded for human review; no short atomic guidance lead was detected."
    },
    {
      "section_path": [
        "Activity rings",
        "Platform considerations",
        "iOS"
      ],
      "note": "Section recorded for human review; no short atomic guidance lead was detected."
    },
    {
      "section_path": [
        "Activity rings",
        "Resources"
      ],
      "note": "Section recorded for human review; no short atomic guidance lead was detected."
    },
    {
      "section_path": [
        "Activity rings",
        "Resources",
        "Related"
      ],
      "note": "Section recorded for human review; no short atomic guidance lead was detected."
    },
    {
      "section_path": [
        "Activity rings",
        "Resources",
        "Videos"
      ],
      "note": "Section recorded for human review; no short atomic guidance lead was detected."
    },
    {
      "section_path": [
        "Activity rings",
        "Change log"
      ],
      "note": "Section recorded for human review; no short atomic guidance lead was detected."
    }
  ],
  "related_hig_urls": [
    "https://developer.apple.com/design/human-interface-guidelines/workouts"
  ]
}
