{
  "schema_version": "1.0.0",
  "url": "https://developer.apple.com/design/human-interface-guidelines/action-button",
  "canonical_url": "https://developer.apple.com/design/human-interface-guidelines/action-button",
  "slug": "action-button",
  "title": "Action button",
  "category": "inputs",
  "page_kind": "guidance",
  "platforms": [
    "ios",
    "watchos"
  ],
  "retrieved_at": "2026-07-21T09:49:33.352Z",
  "source_hash": "203be0bf30dae995ba3fdd3ab958ca205cf84f94528aaa02af5a6772159bd5fc",
  "summary": {
    "en": "Action button organizes Apple design guidance across 7 documented section paths.",
    "ja": "Action buttonに関するAppleの設計ガイダンスを、7件のセクション階層で整理した記録です。"
  },
  "section_paths": [
    [
      "Action button",
      "Best practices"
    ],
    [
      "Action button",
      "Platform considerations"
    ],
    [
      "Action button",
      "Platform considerations",
      "iOS"
    ],
    [
      "Action button",
      "Platform considerations",
      "watchOS"
    ],
    [
      "Action button",
      "Resources"
    ],
    [
      "Action button",
      "Resources",
      "Related"
    ],
    [
      "Action button",
      "Change log"
    ]
  ],
  "guidance_candidates": [
    {
      "text": "Support the Action button with a set of your app’s essential functions",
      "section_path": [
        "Action button",
        "Best practices"
      ],
      "source_sentence_hash": "75af0a1791af76e1c1dea9d031befb29142e8d92620418fb3e6097a7fd77aba6",
      "word_count": 12
    },
    {
      "text": "For each action you support, write a short label that succinctly describes it",
      "section_path": [
        "Action button",
        "Best practices"
      ],
      "source_sentence_hash": "e2185beae73eaf576b24904fbc60cec4fee3b677f385ddd81c7e57374c88acd2",
      "word_count": 13
    },
    {
      "text": "Prefer letting the system show people how to use the Action button with your app",
      "section_path": [
        "Action button",
        "Best practices"
      ],
      "source_sentence_hash": "8fbfcd718793e71e7f42859a1f756087eacb3554e5917a8fdcae00c4cb0a1b1d",
      "word_count": 15
    },
    {
      "text": "Let people use your actions without leaving their current context",
      "section_path": [
        "Action button",
        "Platform considerations",
        "iOS"
      ],
      "source_sentence_hash": "74b52b2c816e9e990c271d3eae63736826949e56dd81f1b0450d6786227afad3",
      "word_count": 10
    },
    {
      "text": "Consider offering a secondary function that supports or advances the primary action people choose",
      "section_path": [
        "Action button",
        "Platform considerations",
        "watchOS"
      ],
      "source_sentence_hash": "1f5ba94bb7ee4ee4b74f634bcdfbfadf051911fd1fbcc2972fc0dedd8687bf73",
      "word_count": 14
    },
    {
      "text": "Prefer using subsequent button presses to support additional functionality rather than to stop or conclude a function",
      "section_path": [
        "Action button",
        "Platform considerations",
        "watchOS"
      ],
      "source_sentence_hash": "1aedbd05008c7dbeb2d7454e4e34a26dc30be17e9dac58206d821091a89d409d",
      "word_count": 17
    },
    {
      "text": "Pause the current function when people press the Action button and side button together",
      "section_path": [
        "Action button",
        "Platform considerations",
        "watchOS"
      ],
      "source_sentence_hash": "44e56a3bf7e44ab311fd8e6fca775517d8829fe4811a472d297fd1a575b04c3a",
      "word_count": 14
    }
  ],
  "reference_notes": [
    {
      "section_path": [
        "Action button",
        "Platform considerations"
      ],
      "note": "Section recorded for human review; no short atomic guidance lead was detected."
    },
    {
      "section_path": [
        "Action button",
        "Resources"
      ],
      "note": "Section recorded for human review; no short atomic guidance lead was detected."
    },
    {
      "section_path": [
        "Action button",
        "Resources",
        "Related"
      ],
      "note": "Section recorded for human review; no short atomic guidance lead was detected."
    },
    {
      "section_path": [
        "Action button",
        "Change log"
      ],
      "note": "Section recorded for human review; no short atomic guidance lead was detected."
    }
  ],
  "related_hig_urls": [
    "https://developer.apple.com/design/human-interface-guidelines/app-shortcuts",
    "https://developer.apple.com/design/human-interface-guidelines/live-activities",
    "https://developer.apple.com/design/human-interface-guidelines/workouts",
    "https://developer.apple.com/design/human-interface-guidelines/digital-crown"
  ]
}
