{
  "schema_version": "1.0.0",
  "url": "https://developer.apple.com/design/human-interface-guidelines/nfc",
  "canonical_url": "https://developer.apple.com/design/human-interface-guidelines/nfc",
  "slug": "nfc",
  "title": "NFC",
  "category": "technologies",
  "page_kind": "guidance",
  "platforms": [
    "ios",
    "ipados"
  ],
  "retrieved_at": "2026-07-21T09:50:03.642Z",
  "source_hash": "7be779732942e6b71da4a015cc6009d3777b263809ee614497a7fdcca7c02a7d",
  "summary": {
    "en": "NFC organizes Apple design guidance across 5 documented section paths.",
    "ja": "NFCに関するAppleの設計ガイダンスを、5件のセクション階層で整理した記録です。"
  },
  "section_paths": [
    [
      "NFC",
      "In-app tag reading"
    ],
    [
      "NFC",
      "Background tag reading"
    ],
    [
      "NFC",
      "Platform considerations"
    ],
    [
      "NFC",
      "Resources"
    ],
    [
      "NFC",
      "Resources",
      "Developer documentation"
    ]
  ],
  "guidance_candidates": [
    {
      "text": "Don’t encourage people to make contact with physical objects",
      "section_path": [
        "NFC",
        "In-app tag reading"
      ],
      "source_sentence_hash": "7f6092f903d4d42cf2a26a27337f9191a426396bc1a0e3cfcbff04719595cfe3",
      "word_count": 9
    },
    {
      "text": "Use approachable terminology",
      "section_path": [
        "NFC",
        "In-app tag reading"
      ],
      "source_sentence_hash": "10bf11fae7086130b6580460688d917b1577ea965bba8ba554ad2b52791d553c",
      "word_count": 3
    },
    {
      "text": "Provide succinct instructional text for the scanning sheet",
      "section_path": [
        "NFC",
        "In-app tag reading"
      ],
      "source_sentence_hash": "d0d750fc7debe0ae38f717037d937501a73c2b8b7f188ee57a8d3159876fbde0",
      "word_count": 8
    },
    {
      "text": "Support both background and in-app tag reading",
      "section_path": [
        "NFC",
        "Background tag reading"
      ],
      "source_sentence_hash": "9f6b14dd325fe5bb0f9e2734510b98e510c18b5e0b4962b735fe0349c5f4e9cc",
      "word_count": 7
    },
    {
      "text": "Developer documentation",
      "section_path": [
        "NFC",
        "Resources",
        "Developer documentation"
      ],
      "source_sentence_hash": "b985db6433c8e9669caebab194ee62b3b3af7505decd93ea111f546d714e1907",
      "word_count": 2
    }
  ],
  "reference_notes": [
    {
      "section_path": [
        "NFC",
        "Platform considerations"
      ],
      "note": "Section recorded for human review; no short atomic guidance lead was detected."
    },
    {
      "section_path": [
        "NFC",
        "Resources"
      ],
      "note": "Section recorded for human review; no short atomic guidance lead was detected."
    }
  ],
  "related_hig_urls": []
}
