{
  "schema_version": "1.0.0",
  "url": "https://developer.apple.com/design/human-interface-guidelines/designing-for-ios",
  "canonical_url": "https://developer.apple.com/design/human-interface-guidelines/designing-for-ios",
  "slug": "designing-for-ios",
  "title": "Designing for iOS",
  "category": "getting-started",
  "page_kind": "guidance",
  "platforms": [
    "ios"
  ],
  "retrieved_at": "2026-07-21T07:07:38.138Z",
  "source_hash": "6003e7b6f7e42066fc7144213280eacea566bb51a2adafe0a01a71033a06e919",
  "summary": {
    "en": "Designing for iOS organizes Apple design guidance across 5 documented section paths.",
    "ja": "Designing for iOSに関するAppleの設計ガイダンスを、5件のセクション階層で整理した記録です。"
  },
  "section_paths": [
    [
      "Designing for iOS",
      "Best practices"
    ],
    [
      "Designing for iOS",
      "Resources"
    ],
    [
      "Designing for iOS",
      "Resources",
      "Related"
    ],
    [
      "Designing for iOS",
      "Resources",
      "Developer documentation"
    ],
    [
      "Designing for iOS",
      "Resources",
      "Videos"
    ]
  ],
  "guidance_candidates": [
    {
      "text": "App interactions",
      "section_path": [
        "Designing for iOS"
      ],
      "source_sentence_hash": "29de0adbe10710b6a52186352718f83eed44184defff57cb5e5ded86e2db1687",
      "word_count": 2
    },
    {
      "text": "System features",
      "section_path": [
        "Designing for iOS"
      ],
      "source_sentence_hash": "828be550252508225168029dca1fde7fb9ae8837c699dbaf3253851975fe7f12",
      "word_count": 2
    },
    {
      "text": "Developer documentation",
      "section_path": [
        "Designing for iOS",
        "Resources",
        "Developer documentation"
      ],
      "source_sentence_hash": "b985db6433c8e9669caebab194ee62b3b3af7505decd93ea111f546d714e1907",
      "word_count": 2
    }
  ],
  "reference_notes": [
    {
      "section_path": [
        "Designing for iOS",
        "Best practices"
      ],
      "note": "Section recorded for human review; no short atomic guidance lead was detected."
    },
    {
      "section_path": [
        "Designing for iOS",
        "Resources"
      ],
      "note": "Section recorded for human review; no short atomic guidance lead was detected."
    },
    {
      "section_path": [
        "Designing for iOS",
        "Resources",
        "Related"
      ],
      "note": "Section recorded for human review; no short atomic guidance lead was detected."
    },
    {
      "section_path": [
        "Designing for iOS",
        "Resources",
        "Videos"
      ],
      "note": "Section recorded for human review; no short atomic guidance lead was detected."
    }
  ],
  "related_hig_urls": [
    "https://developer.apple.com/design/human-interface-guidelines/gestures",
    "https://developer.apple.com/design/human-interface-guidelines/virtual-keyboards",
    "https://developer.apple.com/design/human-interface-guidelines/siri",
    "https://developer.apple.com/design/human-interface-guidelines/privacy",
    "https://developer.apple.com/design/human-interface-guidelines/gyro-and-accelerometer",
    "https://developer.apple.com/design/human-interface-guidelines/spatial-interactions",
    "https://developer.apple.com/design/human-interface-guidelines/widgets",
    "https://developer.apple.com/design/human-interface-guidelines/home-screen-quick-actions",
    "https://developer.apple.com/design/human-interface-guidelines/searching",
    "https://developer.apple.com/design/human-interface-guidelines/activity-views"
  ]
}
