{
  "schema_version": "1.0.0",
  "url": "https://developer.apple.com/design/human-interface-guidelines/remotes",
  "canonical_url": "https://developer.apple.com/design/human-interface-guidelines/remotes",
  "slug": "remotes",
  "title": "Remotes",
  "category": "inputs",
  "page_kind": "guidance",
  "platforms": [
    "tvos"
  ],
  "retrieved_at": "2026-07-21T07:08:06.734Z",
  "source_hash": "1fa8de3cc9bfbe1e88d392361b99e9dbd3f1f51cc10fd33aed069cfc86ff8a0a",
  "summary": {
    "en": "Remotes organizes Apple design guidance across 7 documented section paths.",
    "ja": "Remotesに関するAppleの設計ガイダンスを、7件のセクション階層で整理した記録です。"
  },
  "section_paths": [
    [
      "Remotes",
      "Best practices"
    ],
    [
      "Remotes",
      "Gestures"
    ],
    [
      "Remotes",
      "Buttons"
    ],
    [
      "Remotes",
      "Compatible remotes"
    ],
    [
      "Remotes",
      "Platform considerations"
    ],
    [
      "Remotes",
      "Resources"
    ],
    [
      "Remotes",
      "Resources",
      "Related"
    ]
  ],
  "guidance_candidates": [
    {
      "text": "Prefer using standard gestures to perform standard actions",
      "section_path": [
        "Remotes",
        "Best practices"
      ],
      "source_sentence_hash": "f529839c20138298b3abe868421b756df9bc27702c303b498964e114c671ec7b",
      "word_count": 8
    },
    {
      "text": "Be consistent with the tvOS focus experience",
      "section_path": [
        "Remotes",
        "Best practices"
      ],
      "source_sentence_hash": "bfdfb0b7bc5bb670102883e989ff75914abadaf1990f124391f26512808173be",
      "word_count": 7
    },
    {
      "text": "Provide clear feedback that shows people what happens when they make gestures in your app",
      "section_path": [
        "Remotes",
        "Best practices"
      ],
      "source_sentence_hash": "661fc37a62950f5be8c8192107929b97944976eb1971e7c51387805ac165fa25",
      "word_count": 15
    },
    {
      "text": "Define new gestures only when it makes sense in your app",
      "section_path": [
        "Remotes",
        "Best practices"
      ],
      "source_sentence_hash": "3dc1f921e4c34d0f629c3cf51d79985a67f3542bfed2e83db23162ac1b4669d4",
      "word_count": 11
    },
    {
      "text": "Differentiate between press and tap, and avoid responding to an inadvertent tap",
      "section_path": [
        "Remotes",
        "Best practices"
      ],
      "source_sentence_hash": "f773459ee924c053e76741ae0e5faa77f5459290b551b3d00f58e0da343923b3",
      "word_count": 12
    },
    {
      "text": "Consider using the position of a tap to aid with navigation or gameplay",
      "section_path": [
        "Remotes",
        "Best practices"
      ],
      "source_sentence_hash": "5b1f361d3c2752567c58af30a547265fcba9b84c96b0414d6f746f8a8f867ef7",
      "word_count": 13
    },
    {
      "text": "In almost all cases, open the parent of the current screen when people press the Back button",
      "section_path": [
        "Remotes",
        "Best practices"
      ],
      "source_sentence_hash": "4bcd5c02b266c524acd4b96967c07203e017c8fa9c34f6a6737ec29f93eca2bf",
      "word_count": 17
    },
    {
      "text": "Respond correctly to the Play/Pause button during media playback",
      "section_path": [
        "Remotes",
        "Best practices"
      ],
      "source_sentence_hash": "2e5aadfa288a31a82c961d2b1eeadd7faab8a34db5eaa1861021bb2ef5bf6ba2",
      "word_count": 9
    },
    {
      "text": "If your live-viewing app provides an EPG, respond to a remote’s EPG-browsing buttons in ways people expect",
      "section_path": [
        "Remotes",
        "Compatible remotes"
      ],
      "source_sentence_hash": "77b32b89f302945bae87fa449068c0e59080f0918fc5429f4e5af36d94a39d01",
      "word_count": 17
    },
    {
      "text": "While your content plays, respond to a compatible remote’s “page up” or “page down” button by changing the channel",
      "section_path": [
        "Remotes",
        "Compatible remotes"
      ],
      "source_sentence_hash": "2272ddeddeab99c4d7af0e573842f679c2eec6cc2a9bf4b010976bcdb52aeeec",
      "word_count": 19
    }
  ],
  "reference_notes": [
    {
      "section_path": [
        "Remotes",
        "Gestures"
      ],
      "note": "Section recorded for human review; no short atomic guidance lead was detected."
    },
    {
      "section_path": [
        "Remotes",
        "Buttons"
      ],
      "note": "Section recorded for human review; no short atomic guidance lead was detected."
    },
    {
      "section_path": [
        "Remotes",
        "Platform considerations"
      ],
      "note": "Section recorded for human review; no short atomic guidance lead was detected."
    },
    {
      "section_path": [
        "Remotes",
        "Resources"
      ],
      "note": "Section recorded for human review; no short atomic guidance lead was detected."
    },
    {
      "section_path": [
        "Remotes",
        "Resources",
        "Related"
      ],
      "note": "Section recorded for human review; no short atomic guidance lead was detected."
    }
  ],
  "related_hig_urls": [
    "https://developer.apple.com/design/human-interface-guidelines/focus-and-selection",
    "https://developer.apple.com/design/human-interface-guidelines/live-viewing-apps"
  ]
}
