{
  "schema_version": "1.0.0",
  "url": "https://developer.apple.com/design/human-interface-guidelines/getting-started",
  "canonical_url": "https://developer.apple.com/design/human-interface-guidelines/getting-started",
  "slug": "getting-started",
  "title": "Getting started",
  "category": "getting-started",
  "page_kind": "category",
  "platforms": [
    "ios",
    "ipados",
    "macos",
    "tvos",
    "visionos",
    "watchos"
  ],
  "retrieved_at": "2026-07-21T09:49:50.841Z",
  "source_hash": "5c68e66570ae6dd85e477625f58dfe09b1cdad03fb77e38dd8f400c4f0dc88cc",
  "summary": {
    "en": "Getting started organizes Apple design guidance across 1 documented section paths.",
    "ja": "Getting startedに関するAppleの設計ガイダンスを、1件のセクション階層で整理した記録です。"
  },
  "section_paths": [
    [
      "Getting started",
      "Overview"
    ]
  ],
  "guidance_candidates": [],
  "reference_notes": [],
  "related_hig_urls": [
    "https://developer.apple.com/design/human-interface-guidelines/design-principles",
    "https://developer.apple.com/design/human-interface-guidelines/designing-for-ios",
    "https://developer.apple.com/design/human-interface-guidelines/designing-for-ipados",
    "https://developer.apple.com/design/human-interface-guidelines/designing-for-macos",
    "https://developer.apple.com/design/human-interface-guidelines/designing-for-tvos",
    "https://developer.apple.com/design/human-interface-guidelines/designing-for-visionos",
    "https://developer.apple.com/design/human-interface-guidelines/designing-for-watchos",
    "https://developer.apple.com/design/human-interface-guidelines/designing-for-games"
  ]
}
