{
  "schema_version": "1.0.0",
  "url": "https://developer.apple.com/design/human-interface-guidelines/selection-and-input",
  "canonical_url": "https://developer.apple.com/design/human-interface-guidelines/selection-and-input",
  "slug": "selection-and-input",
  "title": "Selection and input",
  "category": "components",
  "page_kind": "subcategory",
  "platforms": [
    "ios",
    "ipados",
    "macos",
    "tvos",
    "visionos",
    "watchos"
  ],
  "retrieved_at": "2026-07-21T07:08:09.759Z",
  "source_hash": "e0d1b91107969ca65859494686c37a3577be0566ca4345a37ba43ab3fe164c22",
  "summary": {
    "en": "Selection and input organizes Apple design guidance across 1 documented section paths.",
    "ja": "Selection and inputに関するAppleの設計ガイダンスを、1件のセクション階層で整理した記録です。"
  },
  "section_paths": [
    [
      "Selection and input",
      "Overview"
    ]
  ],
  "guidance_candidates": [],
  "reference_notes": [],
  "related_hig_urls": [
    "https://developer.apple.com/design/human-interface-guidelines/color-wells",
    "https://developer.apple.com/design/human-interface-guidelines/combo-boxes",
    "https://developer.apple.com/design/human-interface-guidelines/digit-entry-views",
    "https://developer.apple.com/design/human-interface-guidelines/image-wells",
    "https://developer.apple.com/design/human-interface-guidelines/pickers",
    "https://developer.apple.com/design/human-interface-guidelines/segmented-controls",
    "https://developer.apple.com/design/human-interface-guidelines/sliders",
    "https://developer.apple.com/design/human-interface-guidelines/steppers",
    "https://developer.apple.com/design/human-interface-guidelines/text-fields",
    "https://developer.apple.com/design/human-interface-guidelines/toggles",
    "https://developer.apple.com/design/human-interface-guidelines/virtual-keyboards"
  ]
}
