{
  "schema_version": "1.0.0",
  "url": "https://developer.apple.com/design/human-interface-guidelines/token-fields",
  "canonical_url": "https://developer.apple.com/design/human-interface-guidelines/token-fields",
  "slug": "token-fields",
  "title": "Token fields",
  "category": "components",
  "page_kind": "guidance",
  "platforms": [
    "macos"
  ],
  "retrieved_at": "2026-07-21T07:08:16.624Z",
  "source_hash": "3ae24bde17764abb88e0019d3d7aea174f210548c55e7d6656d345a809048e96",
  "summary": {
    "en": "Token fields organizes Apple design guidance across 5 documented section paths.",
    "ja": "Token fieldsに関するAppleの設計ガイダンスを、5件のセクション階層で整理した記録です。"
  },
  "section_paths": [
    [
      "Token fields",
      "Best practices"
    ],
    [
      "Token fields",
      "Platform considerations"
    ],
    [
      "Token fields",
      "Resources"
    ],
    [
      "Token fields",
      "Resources",
      "Related"
    ],
    [
      "Token fields",
      "Resources",
      "Developer documentation"
    ]
  ],
  "guidance_candidates": [
    {
      "text": "Add value with a context menu",
      "section_path": [
        "Token fields",
        "Best practices"
      ],
      "source_sentence_hash": "55c286aac0f3341dd94df83932fc0f3a5b57b8c2ac5178b9670edc127aa84083",
      "word_count": 6
    },
    {
      "text": "Consider providing additional ways to convert text into tokens",
      "section_path": [
        "Token fields",
        "Best practices"
      ],
      "source_sentence_hash": "9c75501bb2d1e1115bde0e8fcdc477168776a54e95ef77989b96072635900e4c",
      "word_count": 9
    },
    {
      "text": "Consider customizing the delay the system uses before showing suggested tokens",
      "section_path": [
        "Token fields",
        "Best practices"
      ],
      "source_sentence_hash": "f802bb0c25774d118cba1ce9e4c4e0af07813c0b07ae065b90771a873c806dff",
      "word_count": 11
    },
    {
      "text": "Developer documentation",
      "section_path": [
        "Token fields",
        "Resources",
        "Developer documentation"
      ],
      "source_sentence_hash": "b985db6433c8e9669caebab194ee62b3b3af7505decd93ea111f546d714e1907",
      "word_count": 2
    }
  ],
  "reference_notes": [
    {
      "section_path": [
        "Token fields",
        "Platform considerations"
      ],
      "note": "Section recorded for human review; no short atomic guidance lead was detected."
    },
    {
      "section_path": [
        "Token fields",
        "Resources"
      ],
      "note": "Section recorded for human review; no short atomic guidance lead was detected."
    },
    {
      "section_path": [
        "Token fields",
        "Resources",
        "Related"
      ],
      "note": "Section recorded for human review; no short atomic guidance lead was detected."
    }
  ],
  "related_hig_urls": [
    "https://developer.apple.com/design/human-interface-guidelines/search-fields",
    "https://developer.apple.com/design/human-interface-guidelines/context-menus",
    "https://developer.apple.com/design/human-interface-guidelines/text-fields"
  ]
}
