{
  "schema_version": "1.0.0",
  "url": "https://developer.apple.com/design/human-interface-guidelines/snippets",
  "canonical_url": "https://developer.apple.com/design/human-interface-guidelines/snippets",
  "slug": "snippets",
  "title": "Snippets",
  "category": "components",
  "page_kind": "guidance",
  "platforms": [
    "ios",
    "ipados",
    "macos"
  ],
  "retrieved_at": "2026-09-07T22:04:26.596Z",
  "source_hash": "8a9b20a28c21ffc10eb12ea146f8f53e378ecc7bb3d242f6806f9d2d2157a08e",
  "summary": {
    "en": "Snippets organizes Apple design guidance across 8 documented section paths.",
    "ja": "Snippetsに関するAppleの設計ガイダンスを、8件のセクション階層で整理した記録です。"
  },
  "section_paths": [
    [
      "Snippets",
      "Anatomy"
    ],
    [
      "Snippets",
      "Best practices"
    ],
    [
      "Snippets",
      "Platform considerations"
    ],
    [
      "Snippets",
      "Resources"
    ],
    [
      "Snippets",
      "Resources",
      "Related"
    ],
    [
      "Snippets",
      "Resources",
      "Developer documentation"
    ],
    [
      "Snippets",
      "Resources",
      "Videos"
    ],
    [
      "Snippets",
      "Change log"
    ]
  ],
  "guidance_candidates": [
    {
      "text": "Custom view",
      "section_path": [
        "Snippets",
        "Anatomy"
      ],
      "source_sentence_hash": "4db6b5484245628c436111402d3c0faa1b79b9418f2811dacaef39a2f1ec8108",
      "word_count": 2
    },
    {
      "text": "System-provided button(s)",
      "section_path": [
        "Snippets",
        "Anatomy"
      ],
      "source_sentence_hash": "37fa3796323ec6f886092c634094cf506cf79b7e9a971be6a46ce208ebc2fc3c",
      "word_count": 2
    },
    {
      "text": "Ensure legibility",
      "section_path": [
        "Snippets",
        "Best practices"
      ],
      "source_sentence_hash": "520b1c1748b54a868ae7eaa6a5d0e1e72a8c794146532269e47769d3ab95343a",
      "word_count": 2
    },
    {
      "text": "Keep consistent margins within a snippet custom view",
      "section_path": [
        "Snippets",
        "Best practices"
      ],
      "source_sentence_hash": "89ab7220d690bed36da0d78f8b38022f22759617ffde093d378cddc2187638fc",
      "word_count": 8
    },
    {
      "text": "Keep content concise",
      "section_path": [
        "Snippets",
        "Best practices"
      ],
      "source_sentence_hash": "93901a05d0b62d211650d3359981295fd224272baded12e08d35d6e39c845edf",
      "word_count": 3
    },
    {
      "text": "To ensure all content is visible, create custom views no taller than 400 points",
      "section_path": [
        "Snippets",
        "Best practices"
      ],
      "source_sentence_hash": "a32e200f691d12640c7ed98fa4345fad9ad278fe0b8c8383f2eba8ed4835f295",
      "word_count": 14
    },
    {
      "text": "Account for preferred text sizes when deciding how much text to include",
      "section_path": [
        "Snippets",
        "Best practices"
      ],
      "source_sentence_hash": "d62331b34e19a7da1143ee8c46477f50a1d8aed45a722ba1c1ead31afb958de8",
      "word_count": 12
    },
    {
      "text": "For detailed result content, deep-link to the app instead of expanding the custom view",
      "section_path": [
        "Snippets",
        "Best practices"
      ],
      "source_sentence_hash": "7da4b481da4344dbbcc979b84908c3c708810ee6390cddde876714ba9a499318",
      "word_count": 14
    },
    {
      "text": "Choose a descriptive label for a confirmation snippet’s primary button",
      "section_path": [
        "Snippets",
        "Best practices"
      ],
      "source_sentence_hash": "9c788f4d322d345e0fef3e808025c39666226f33d9f6d05835b746f6763edbac",
      "word_count": 10
    },
    {
      "text": "Communicate a snippet’s purpose visually",
      "section_path": [
        "Snippets",
        "Best practices"
      ],
      "source_sentence_hash": "a212ca7558bc86ee8ea2a54fbd86748cf002e792e21bfab530559c23389770dc",
      "word_count": 5
    },
    {
      "text": "Don’t rely on showing dialogue text to convey a snippet’s purpose",
      "section_path": [
        "Snippets",
        "Best practices"
      ],
      "source_sentence_hash": "68313592a607e7fff04bf69ccd39dc880ff4766b63de141a6ee437f27613d2ff",
      "word_count": 11
    },
    {
      "text": "Prefer omitting dialogue text from a snippet’s visual representation",
      "section_path": [
        "Snippets",
        "Best practices"
      ],
      "source_sentence_hash": "27f9098f708a2bd5de82a8b6ac922e9707ba4307bbad368d5a0945cd02d91822",
      "word_count": 9
    },
    {
      "text": "Avoid snippets on tvOS, visionOS, and watchOS",
      "section_path": [
        "Snippets",
        "Platform considerations"
      ],
      "source_sentence_hash": "9d6929cb7eb779488104d38496afb18a9fd4a0ee2d8cff96b99b919156507463",
      "word_count": 8
    },
    {
      "text": "Developer documentation",
      "section_path": [
        "Snippets",
        "Resources",
        "Developer documentation"
      ],
      "source_sentence_hash": "b985db6433c8e9669caebab194ee62b3b3af7505decd93ea111f546d714e1907",
      "word_count": 2
    }
  ],
  "reference_notes": [
    {
      "section_path": [
        "Snippets",
        "Platform considerations"
      ],
      "note": "Reviewed the page-local platform context; no additional platform capabilities were inferred."
    },
    {
      "section_path": [
        "Snippets",
        "Resources"
      ],
      "note": "Reviewed resource navigation and change-log context; no additional page-local guidance was identified."
    },
    {
      "section_path": [
        "Snippets",
        "Resources",
        "Related"
      ],
      "note": "Reviewed resource navigation and change-log context; no additional page-local guidance was identified."
    },
    {
      "section_path": [
        "Snippets",
        "Resources",
        "Videos"
      ],
      "note": "Reviewed resource navigation and change-log context; no additional page-local guidance was identified."
    },
    {
      "section_path": [
        "Snippets",
        "Change log"
      ],
      "note": "Reviewed resource navigation and change-log context; no additional page-local guidance was identified."
    }
  ],
  "related_hig_urls": [
    "https://developer.apple.com/design/human-interface-guidelines/siri",
    "https://developer.apple.com/design/human-interface-guidelines/app-shortcuts",
    "https://developer.apple.com/design/human-interface-guidelines/live-activities"
  ]
}
