{
  "schema_version": "1.0.0",
  "url": "https://developer.apple.com/design/human-interface-guidelines/watch-faces",
  "canonical_url": "https://developer.apple.com/design/human-interface-guidelines/watch-faces",
  "slug": "watch-faces",
  "title": "Watch faces",
  "category": "components",
  "page_kind": "guidance",
  "platforms": [
    "watchos"
  ],
  "retrieved_at": "2026-07-21T09:50:22.013Z",
  "source_hash": "7f9e51e5f18bcade728d8312295c22a46aa0b63125e4c54a060e905e4617b574",
  "summary": {
    "en": "Watch faces organizes Apple design guidance across 5 documented section paths.",
    "ja": "Watch facesに関するAppleの設計ガイダンスを、5件のセクション階層で整理した記録です。"
  },
  "section_paths": [
    [
      "Watch faces",
      "Best practices"
    ],
    [
      "Watch faces",
      "Platform considerations"
    ],
    [
      "Watch faces",
      "Resources"
    ],
    [
      "Watch faces",
      "Resources",
      "Related"
    ],
    [
      "Watch faces",
      "Resources",
      "Developer documentation"
    ]
  ],
  "guidance_candidates": [
    {
      "text": "Help people discover your app by sharing watch faces that feature your complications",
      "section_path": [
        "Watch faces",
        "Best practices"
      ],
      "source_sentence_hash": "de2b19986ca32db52b7c837c7b9f52fdb7fce3c26c94c5d8fa94ba78b7f68841",
      "word_count": 13
    },
    {
      "text": "Display a preview of each watch face you share",
      "section_path": [
        "Watch faces",
        "Best practices"
      ],
      "source_sentence_hash": "136255912a34f89e2fe40efb3b1f2d687ff18cc3854ac1d1b9e9f5f6487b947d",
      "word_count": 9
    },
    {
      "text": "Aim to offer shareable watch faces for all Apple Watch devices",
      "section_path": [
        "Watch faces",
        "Best practices"
      ],
      "source_sentence_hash": "b4984b6efa9a2fb1ce2f5c7fe7e70381860952ceeeb5504ea27c218e17f952bb",
      "word_count": 11
    },
    {
      "text": "Respond gracefully if people choose an incompatible watch face",
      "section_path": [
        "Watch faces",
        "Best practices"
      ],
      "source_sentence_hash": "01f73c359c28dfc7daa6d23ebed128751b92fe37afb707d794327fc67506b7a2",
      "word_count": 9
    },
    {
      "text": "Developer documentation",
      "section_path": [
        "Watch faces",
        "Resources",
        "Developer documentation"
      ],
      "source_sentence_hash": "b985db6433c8e9669caebab194ee62b3b3af7505decd93ea111f546d714e1907",
      "word_count": 2
    }
  ],
  "reference_notes": [
    {
      "section_path": [
        "Watch faces",
        "Platform considerations"
      ],
      "note": "Section recorded for human review; no short atomic guidance lead was detected."
    },
    {
      "section_path": [
        "Watch faces",
        "Resources"
      ],
      "note": "Section recorded for human review; no short atomic guidance lead was detected."
    },
    {
      "section_path": [
        "Watch faces",
        "Resources",
        "Related"
      ],
      "note": "Section recorded for human review; no short atomic guidance lead was detected."
    }
  ],
  "related_hig_urls": []
}
